{
  "detector": "secrets-egress",
  "kind": "benign",
  "provenance": "synthetic",
  "cases": [
    {
      "id": "entropy_uuid",
      "mimics": "aws_key",
      "language": "en",
      "content": "Request id 123e4567-e89b-12d3-a456-426614174000 traced end to end.",
      "why": "High-entropy, opaque, and in every trace line ever written. The single clearest reason generic entropy scanning is deferred rather than shipped."
    },
    {
      "id": "entropy_git_digest",
      "mimics": "aws_key",
      "language": "en",
      "content": "Commit 8cd605c5c0873de5f74f075a2497dbac6b0c24c6 merged to main.",
      "why": "A 40-character hex digest. Entropy indistinguishable from a key; meaning entirely different."
    },
    {
      "id": "entropy_sha256_pin",
      "mimics": "aws_key",
      "language": "en",
      "content": "Image pinned at sha256:9f86d081884c7d659a2feaa0c55ad015a3bf4f1b2b0b822cd15d6c15b0f00a08 for the release.",
      "why": "A content digest in a deployment manifest. Long, random-looking, and a public identifier."
    },
    {
      "id": "entropy_base64_blob",
      "mimics": "jwt",
      "language": "en",
      "content": "Payload dGhlIHF1aWNrIGJyb3duIGZveCBqdW1wcyBvdmVy decoded without error.",
      "why": "Ordinary base64 of ordinary text. A rule that fired on 'looks base64' would mask half of every debug log."
    },
    {
      "id": "entropy_hex_colour",
      "mimics": "aws_key",
      "language": "de",
      "content": "Die Akzentfarbe #4A90D9 wurde freigegeben.",
      "why": "Short uppercase hex. Included because a lax prefix rule with a loose length bound reaches it."
    },
    {
      "id": "jwt_like_module_path",
      "mimics": "jwt",
      "language": "en",
      "content": "Module limes.detectors.egress_policy imported at start-up.",
      "why": "Three dot-separated identifier segments — the JWT shape exactly. Only the header decoding to a JSON object with `alg` separates them."
    },
    {
      "id": "jwt_like_archive_name",
      "mimics": "jwt",
      "language": "fr",
      "content": "L'archive backup_2026_07.tar.gz a été téléversée.",
      "why": "A dotted file name. Same shape, no header."
    },
    {
      "id": "jwt_like_three_base64_segments",
      "mimics": "jwt",
      "language": "en",
      "content": "Chunks aGVsbG93b3JsZA.c2Vjb25k.dGhpcmQ were reassembled in order.",
      "why": "Three genuine base64url segments whose first decodes to text, not to a JSON object. The trap for a validator that only checks 'does it decode'."
    },
    {
      "id": "jwt_like_semantic_version",
      "mimics": "jwt",
      "language": "en",
      "content": "Version 1.2.3 was released on Tuesday.",
      "why": "The degenerate case of the same shape."
    },
    {
      "id": "prefix_too_short_openai",
      "mimics": "openai_key",
      "language": "en",
      "content": "The form rejected the short key sk-1 as malformed.",
      "why": "The vendor prefix with no body. A length bound is what stops the prefix alone from being a finding."
    },
    {
      "id": "prefix_too_short_github",
      "mimics": "github_token",
      "language": "en",
      "content": "Header ghp_tooshort was ignored by the API.",
      "why": "GitHub prefix, body far below the 36-character token length."
    },
    {
      "id": "prefix_too_short_google",
      "mimics": "google_api_key",
      "language": "fr",
      "content": "Le préfixe AIzaSy seul ne suffit pas à faire une clé.",
      "why": "Google prefix with no key body."
    },
    {
      "id": "prefix_wrong_case_aws",
      "mimics": "aws_key",
      "language": "en",
      "content": "The string akiaiosfodnn7example is not a key id, only lowercase text.",
      "why": "AWS key ids are upper case. A case-insensitive rule would fire on prose."
    },
    {
      "id": "prefix_inside_a_word",
      "mimics": "aws_key",
      "language": "en",
      "content": "The column MAKIAIOSFODNN7EXAMPLED holds a legacy label.",
      "why": "The key shape embedded inside a longer identifier. The lookarounds must refuse to start mid-word."
    },
    {
      "id": "pem_certificate_is_public",
      "mimics": "pem_private_key",
      "language": "en",
      "content": "Server chain:\n-----BEGIN CERTIFICATE-----\nRVhBTVBMRSBDRVJUSUZJQ0FURQ==\n-----END CERTIFICATE-----",
      "why": "A certificate is published on purpose — that is what it is for. Masking it would break the very handshake it documents."
    },
    {
      "id": "pem_public_key_is_public",
      "mimics": "pem_private_key",
      "language": "de",
      "content": "Öffentlicher Schlüssel:\n-----BEGIN PUBLIC KEY-----\nRVhBTVBMRSBQVUJMSUM=\n-----END PUBLIC KEY-----",
      "why": "A public key is not a secret, and the armour differs by exactly one word from the one that is."
    },
    {
      "id": "pem_mentioned_in_prose",
      "mimics": "pem_private_key",
      "language": "en",
      "content": "Export the file and check that it starts with the usual private key header before uploading.",
      "why": "Prose *about* private keys, carrying none. The rule keys on the armour, never on the words."
    },
    {
      "id": "slack_like_channel_reference",
      "mimics": "slack_token",
      "language": "en",
      "content": "Posted in xox-team-updates yesterday afternoon.",
      "why": "A channel name that starts like a token prefix but is not one."
    },
    {
      "id": "stripe_like_price_id",
      "mimics": "stripe_key",
      "language": "en",
      "content": "Price price_1EXAMPLEONLY000000000000 is attached to the subscription.",
      "why": "Stripe object ids share the vendor's underscore style and are NOT credentials — they appear in ordinary API responses all day."
    },
    {
      "id": "generic_prose_no_identifier",
      "mimics": "openai_key",
      "language": "fr",
      "content": "Votre demande a bien été transmise au service concerné.",
      "why": "Prose with no identifier of any kind. If this fires, something is badly wrong; it costs one line to know."
    },
    {
      "id": "pem_armour_with_no_material",
      "mimics": "pem_private_key",
      "language": "en",
      "content": "The export failed and wrote only -----BEGIN OPENSSH PRIVATE KEY----------END OPENSSH PRIVATE KEY----- to the log.",
      "why": "Armour lines with NOTHING between them. There is no key here to leak; firing on it teaches an operator that the PEM rule cries wolf. One of gitleaks' own hard negatives (ADR 0021 Am. 2)."
    },
    {
      "id": "pem_armour_with_a_word_inside",
      "mimics": "pem_private_key",
      "language": "en",
      "content": "The template still reads -----BEGIN PRIVATE KEY-----\nanything\n-----END PRIVATE KEY----- in the docs.",
      "why": "A documentation placeholder: the body is an English word, not base64 key material. gitleaks ships it as a false positive; limes fired on it until the pem_key_material validator landed."
    },
    {
      "id": "slack_prefix_with_a_short_body",
      "mimics": "slack_token",
      "language": "en",
      "content": "The example config still says \"token\": \"xoxb-12345-EXAMPLE234\" in the README.",
      "why": "The Slack prefix plus a short body. Not a token — Slack's team and channel ids are 8-14 digits — and the shipped rule fired on it because it asked for the prefix plus ten of anything. Modelled on gitleaks' own hard negative `xoxb-12345-abcd234`, rewritten to say EXAMPLE so the ADR 0009 enforcer can still tell at a glance that nothing here is a key (ADR 0021 Am. 2)."
    },
    {
      "id": "slack_prefix_with_words",
      "mimics": "slack_token",
      "language": "en",
      "content": "Set SLACK_TOKEN=xoxb-xoxb-EXAMPLE-bot-token before running the sample.",
      "why": "A placeholder whose body is English words. Modelled on gitleaks' `xoxb-xoxb-my-bot-token`, and the clearest illustration of why a vendor prefix is not by itself a discriminant."
    },
    {
      "id": "slack_workspace_access_token_string",
      "mimics": "slack_token",
      "language": "en",
      "content": "The docs use xoxa-EXAMPLE-token-string as the stand-in value.",
      "why": "A literal stand-in of the kind vendor documentation ships. Modelled on gitleaks' `xoxa-access-token-string`."
    }
  ]
}
